PCF ID,Hierarchy ID,Name,Metrics available?
10626,7.1.6.2,Evaluate IT plan performance,N
10627,7.1.6.3,Communicate IT value,N
10576,7.1.7,Perform IT staff management,N
10628,7.1.7.1,Develop IT leadership and staff,N
10629,7.1.7.2,Manage IT staff performance,N
10577,7.1.8,Manage IT suppliers and contracts,N
10630,7.1.8.1,Develop IT (development and delivery) sourcing strategies,N
10631,7.1.8.2,Negotiate with suppliers,N
10632,7.1.8.3,Establish and maintain supplier relationships,N
10633,7.1.8.4,Evaluate supplier performance,N
10634,7.1.8.5,Assess contract performance,N
10564,7.2,Develop and manage IT customer relationships,Y
10578,7.2.1,Develop IT services and solutions strategy,Y
11244,7.2.1.1,Research IT services and solutions to address business and user requirements,N
11245,7.2.1.2,Translate business and user requirements into IT services and solutions requirements,N
11246,7.2.1.3,Formulate IT services and solutions strategic initiatives,N
11247,7.2.1.4,Coordinate strategies with internal stakeholders to ensure alignment,N
11248,7.2.1.5,Evaluate and select IT services and solutions strategic initiatives,N
10579,7.2.2,Develop and manage IT service levels,N
10640,7.2.2.1,Create and maintain the IT services and solutions catalog,N
10641,7.2.2.2,Establish and maintain business and IT service level agreements,N
10642,7.2.2.3,Evaluate and report service level attainment results,N
10643,7.2.2.4,Communicate business and IT service level improvement opportunities,N
10580,7.2.3,Perform demand side management (DSM) for IT services,N
10644,7.2.3.1,Analyze IT services and solutions consumption and usage,N
10645,7.2.3.2,Develop and implement incentive programs that improve consumption efficiency,N
10646,7.2.3.3,Develop volume/unit forecast for IT services and solutions,N
10581,7.2.4,Manage IT customer satisfaction,Y
10647,7.2.4.1,Capture and analyze customer satisfaction,N
10648,7.2.4.2,Assess and communicate customer satisfaction patterns,N
10649,7.2.4.3,Initiate improvements based on customer satisfaction patterns,N
10582,7.2.5,Market IT services and solutions,N
10650,7.2.5.1,Develop IT services and solutions marketing strategy,N
10651,7.2.5.2,Develop and manage IT customer strategy,N
10652,7.2.5.3,Manage IT services and solutions advertising and promotional campaigns,N
10653,7.2.5.4,Process and track IT services and solutions orders,N
11216,7.3,Manage business resiliency and risk,Y
11217,7.3.1,Develop and manage business resilience,N
11221,7.3.1.1,Develop the business resilience strategy,N
11222,7.3.1.2,Perform continuous business operations planning,N
11223,7.3.1.3,Test continuous business operations,N
11224,7.3.1.4,Maintain continuous business operations,N
11218,7.3.2,Develop and manage regulatory compliance,N
11225,7.3.2.1,Develop the regulatory compliance strategy,N
11226,7.3.2.2,Establish regulatory compliance controls,N
11227,7.3.2.3,Manage regulatory compliance remediation,N
11219,7.3.3,Perform integrated risk management,N
11228,7.3.3.1,Develop an integrated risk strategy and approach,N
11229,7.3.3.2,Manage integrated risks,N
11220,7.3.4,"Develop and implement security, privacy, and data protection controls",Y
11230,7.3.4.1,"Establish information security, privacy, and data protection strategies and levels",N
11231,7.3.4.2,"Test, evaluate, and implement information security, and privacy and data protection controls",N
10565,7.4,Manage enterprise information,Y
10583,7.4.1,Develop information and content management strategies,Y
10654,7.4.1.1,Understand information and content management needs and the role of IT services for executing the business strategy,N
10655,7.4.1.2,Assess the information and content management implications of new technologies,N
10656,7.4.1.3,Identify and prioritize information and content management actions,N
10584,7.4.2,Define the enterprise information architecture,Y
10657,7.4.2.1,"Define information elements, composite structure, logical relationships and constraints, taxonomy, and derivation rules",N
10658,7.4.2.2,Define information access requirements,N
10659,7.4.2.3,Establish data custodianship,N
10660,7.4.2.4,Manage changes to content data architecture requirements,N
10585,7.4.3,Manage information resources,Y
10661,7.4.3.1,Define the enterprise information/data policies and standards,N
10662,7.4.3.2,Develop and implement data and content administration,N
10586,7.4.4,Perform enterprise data and content management,Y
10663,7.4.4.1,Define sources and destinations of content data,N
10664,7.4.4.2,Manage technical interfaces to users of content,N
10665,7.4.4.3,"Manage retention, revision, and retirement of enterprise information",N
10566,7.5,Develop and maintain information technology solutions,Y
10587,7.5.1,Develop the IT development strategy,Y
10666,7.5.1.1,Establish sourcing strategy for IT development,N
10667,7.5.1.2,"Define development processes, methodologies, and tools standards",N
10668,7.5.1.3,Select development methodologies and tools,N
10588,7.5.2,Perform IT services and solutions life cycle planning,N
10669,7.5.2.1,Plan development of new requirements,N
10670,7.5.2.2,Plan development of feature and functionality enhancement,N
10671,7.5.2.3,Develop life cycle plan for IT services and solutions,N
10589,7.5.3,Develop and maintain IT services and solutions architecture,N
10672,7.5.3.1,Create IT services and solutions architecture,N
10673,7.5.3.2,Revise IT services and solutions architecture,N
10674,7.5.3.3,Retire IT services and solutions architecture,N
13623,7.5.4,"Develop project plans for particular IT projects including rough timetables, project budgets",N
13624,7.5.5,Allocate resources for projects,N
10590,7.5.6,Create IT services and solutions,Y
10675,7.5.6.1,Understand confirmed requirements,N
10676,7.5.6.2,Design IT services and solutions,N
10677,7.5.6.3,Acquire/Develop IT service/solution components,N
10678,7.5.6.4,Train services and solutions resources,N
10679,7.5.6.5,Test IT services/solutions,N
10680,7.5.6.6,Confirm customer acceptance,N
13928,7.5.7,Test IT architecture and build-up,N
13625,7.5.7.1,Define testing and acceptance criteria,N
13626,7.5.7.2,Conduct acceptance test,N
13627,7.5.7.3,Implement architecture enhancements,N
13628,7.5.7.4,Transfer to operations,N
10591,7.5.8,Maintain IT services and solutions,Y
10681,7.5.8.1,Understand upkeep/enhance requirements and defect analysis,N
10682,7.5.8.2,Design change to existing IT service/solution,N
10683,7.5.8.3,Acquire/Develop changed IT service/solution component,N
10684,7.5.8.4,Test IT service/solution change,N
10685,7.5.8.5,Retire solutions and services,N
10567,7.6,Deploy information technology solutions,Y
10592,7.6.1,Develop the IT deployment strategy,Y
10686,7.6.1.1,Establish IT services and solutions change policies,N
10687,7.6.1.2,"Define deployment process, procedures, and tools standards",N
10688,7.6.1.3,Select deployment methodologies and tools,N
10593,7.6.2,Plan and implement changes,N
10689,7.6.2.1,Plan change deployment,N
10690,7.6.2.2,Communicate changes to stakeholders,N
10691,7.6.2.3,Administer change schedule,N
10692,7.6.2.4,Train impacted users,N
10693,7.6.2.5,Distribute and install change,N
10694,7.6.2.6,Verify change,N
10594,7.6.3,Plan and manage releases,N
10695,7.6.3.1,Understand and coordinate release design and acceptance,N
10696,7.6.3.2,Plan release rollout,N
10697,7.6.3.3,Distribute and install release,N
10698,7.6.3.4,Verify release,N
10568,7.7,Deliver and support information technology services,Y
10595,7.7.1,Develop IT services and solution delivery strategy,N
10699,7.7.1.1,Establish sourcing strategy for IT delivery,N
10700,7.7.1.2,"Define delivery processes, procedures, and tools standards",N
10701,7.7.1.3,Select delivery methodologies and tools,N
10596,7.7.2,Develop IT support strategy,N
10702,7.7.2.1,Establish sourcing strategy for IT support,N
10703,7.7.2.2,Define IT support services,N
10597,7.7.3,Manage IT infrastructure resources,N
10704,7.7.3.1,Manage IT inventory and assets,N
10705,7.7.3.2,Manage IT resource capacity,N
10598,7.7.4,Manage IT infrastructure operations,N
10706,7.7.4.1,Deliver IT services and solutions,N
10707,7.7.4.2,Perform IT operations support services,N
10599,7.7.5,Support IT services and solutions,Y
10708,7.7.5.1,Manage availability,N
10709,7.7.5.2,Manage facilities,N
10710,7.7.5.3,Manage backup/recovery,N
10711,7.7.5.4,Manage performance and capacity,N
10712,7.7.5.5,Manage incidents,N
10713,7.7.5.6,Manage problems,N
10714,7.7.5.7,Manage inquiries,N
10569,7.8,Manage IT knowledge,Y
10600,7.8.1,Develop IT knowledge management strategy,N
10715,7.8.1.1,Understand IT knowledge needs,N
10716,7.8.1.2,Understand current IT knowledge flow,N
10717,7.8.1.3,Coordinate strategy and roles with the enterprise KM function,N
10718,7.8.1.4,Plan IT knowledge management actions and priorities,N
10601,7.8.2,Develop and maintain IT knowledge map,N
10719,7.8.2.1,"Define knowledge elements, logical relationships and constraints, and currency rules",N
10720,7.8.2.2,Identify IT knowledge sources and repositories,N
10721,7.8.2.3,Identify IT knowledge-sharing opportunities,N
10722,7.8.2.4,Define IT knowledge processes and approaches,N
13629,7.8.2.5,Maintain documentation of changes,N
13630,7.8.2.6,Gather requirements for further developments,N
13631,7.8.2.7,Improve performance,N
10602,7.8.3,Manage IT knowledge life cycle,N
10723,7.8.3.1,Gather knowledge elements from IT knowledge sources,N
10724,7.8.3.2,"Evaluate, create, and codify knowledge elements",N
10725,7.8.3.3,Deploy codified IT knowledge,N
10726,7.8.3.4,Update and retire IT knowledge,N
10727,7.8.3.5,Evaluate and improve IT knowledge strategies and processes,N
10009,8,Manage Financial Resources,Y
10728,8.1,Perform planning and management accounting,Y
10738,8.1.1,Perform planning/budgeting/forecasting,Y
10771,8.1.1.1,Develop and maintain budget policies and procedures,N
10772,8.1.1.2,Prepare periodic budgets and plans,N
10773,8.1.1.3,Prepare periodic financial forecasts,N
10739,8.1.2,Perform cost accounting and control,Y
10774,8.1.2.1,Perform inventory accounting,N
10775,8.1.2.2,Perform cost of sales analysis,N
10776,8.1.2.3,Perform product costing,N
10777,8.1.2.4,Perform variance analysis,N
11175,8.1.2.5,Report on profitability,N
10740,8.1.3,Perform cost management,N
10778,8.1.3.1,Determine key cost drivers,N
10779,8.1.3.2,Measure cost drivers,N
10780,8.1.3.3,Determine critical activities,N
10781,8.1.3.4,Manage asset resource deployment and utilization,N
10741,8.1.4,Evaluate and manage financial performance,Y
10782,8.1.4.1,Assess customer and product profitability,N
10783,8.1.4.2,Evaluate new products,N
10784,8.1.4.3,Perform life cycle costing,N
10785,8.1.4.4,Optimize customer and product mix,N
10786,8.1.4.5,Track performance of new customer and product strategies,N
10787,8.1.4.6,Prepare activity-based performance measures,N
10788,8.1.4.7,Manage continuous cost improvement,N
10729,8.2,Perform revenue accounting,Y
10742,8.2.1,Process customer credit,Y
10789,8.2.1.1,Establish credit policies,Y
10790,8.2.1.2,Analyze/Approve new account applications,Y
10791,8.2.1.3,Review existing accounts,Y
10792,8.2.1.4,Produce credit/collection reports,Y
10793,8.2.1.5,Reinstate or suspend accounts based on credit policies,N
10743,8.2.2,Invoice customer,Y
10794,8.2.2.1,Maintain customer/product master files,Y
10795,8.2.2.2,Generate customer billing data,Y
10796,8.2.2.3,Transmit billing data to customers,Y
10797,8.2.2.4,Post receivable entries,Y
10798,8.2.2.5,Resolve customer billing inquiries,Y
13632,8.2.3,Collect and mediate External Data Representation (xDR's),N
13638,8.2.3.1,Collect invoice relevant data,N
13639,8.2.3.2,Pre-process collected data,N
13633,8.2.4,Apply rating and discounts,N
13640,8.2.4.1,Assess individual call detail records (CDR's),N
13641,8.2.4.2,Apply rates and discounts as applicable to customers and to customer specific conditions,N
13642,8.2.4.3,Apply discounting rules and tariffs,N
13634,8.2.5,Produce and distribute invoices,N
13643,8.2.5.1,Format invoices,N
13644,8.2.5.2,Apply invoice layouts and customization according to customer specific requests,N
13645,8.2.5.3,Produce and distribute invoices,N
13646,8.2.5.4,Transfer to accounts receivable,N
13635,8.2.6,Collect payments,N
13647,8.2.6.1,Check customer accounts,N
13648,8.2.6.2,Transfer overdue payments to Dunning,N
13636,8.2.7,Trigger dunning,N
13649,8.2.7.1,Send reminder invoices,N
13650,8.2.7.2,Notify network services in order to deactivate service for customers with overdue periods,N
13637,8.2.8,Generate invoices for interconnection and roaming,N
13651,8.2.8.1,Identify interconnection and roaming charges,N
13652,8.2.8.2,Issue interconnection and roaming invoices,N
10744,8.2.9,Process accounts receivable (AR),Y
10799,8.2.9.1,Establish AR policies,N
10800,8.2.9.2,Receive/Deposit customer payments,N
10801,8.2.9.3,Apply cash remittances,N
10802,8.2.9.4,Prepare AR reports,N
10803,8.2.9.5,Post AR activity to the general ledger,N
10745,8.2.10,Manage and process collections,Y
10804,8.2.10.1,Establish policies for delinquent accounts,N
10805,8.2.10.2,Analyze delinquent account balances,N
10806,8.2.10.3,Correspond/Negotiate with delinquent accounts,N
10807,8.2.10.4,Discuss account resolution with internal parties,N
10808,8.2.10.5,Process adjustments/write-off balances,Y
10746,8.2.11,Manage and process adjustments/deductions,Y
10809,8.2.11.1,Establish policies/procedures for adjustments,N
10810,8.2.11.2,Analyze adjustments,N
10811,8.2.11.3,Correspond/Negotiate with customer,N
10812,8.2.11.4,Discuss resolution with internal parties,N
10813,8.2.11.5,Prepare chargeback invoices,N
10814,8.2.11.6,Process related entries,N
10730,8.3,Perform general accounting and reporting,Y
10747,8.3.1,Manage policies and procedures,Y
10815,8.3.1.1,Negotiate service level agreements,N
10816,8.3.1.2,Establish accounting policies,N
10817,8.3.1.3,Set and enforce approval limits,N
10818,8.3.1.4,Establish common financial systems,N
10748,8.3.2,Perform general accounting,Y
10819,8.3.2.1,Maintain chart of accounts,N
10820,8.3.2.2,Process journal entries,N
10821,8.3.2.3,Process allocations,N
10822,8.3.2.4,"Process period end adjustments (e.g., accruals, currency conversions, etc.)",N
10823,8.3.2.5,Post and reconcile intercompany transactions,N
10824,8.3.2.6,Reconcile GL accounts,N
10825,8.3.2.7,Perform consolidations and process eliminations,N
10826,8.3.2.8,Prepare trial balance,N
10827,8.3.2.9,Prepare and post management adjustments,N
10749,8.3.3,Perform fixed asset accounting,Y
10828,8.3.3.1,Establish fixed asset policies and procedures,N
10829,8.3.3.2,Maintain fixed asset master data files,N
10830,8.3.3.3,Process and record fixed asset additions and retires,N
10831,8.3.3.4,"Process and record fixed asset adjustments, enhancements, revaluations, and transfers",N
10832,8.3.3.5,Process and record fixed asset maintenance and repair expenses,N
10833,8.3.3.5,Calculate and record depreciation expense,N
10834,8.3.3.6,Reconcile fixed asset ledger,N
10835,8.3.3.7,Track fixed assets including physical inventory,N
10836,8.3.3.8,"Provide fixed asset data to support tax, statutory, and regulatory reporting",N
10750,8.3.4,Perform financial reporting,Y
10837,8.3.4.1,Prepare business unit financial statements,N
10838,8.3.4.2,Prepare consolidated financial statements,N
10839,8.3.4.3,Perform business unit reporting/review management reports,N
10840,8.3.4.4,Perform consolidated reporting/review of cost management reports,N
10841,8.3.4.5,Prepare statements for board review,N
10842,8.3.4.6,Produce quarterly/annual filings and shareholder reports,N
10843,8.3.4.7,Produce regulatory reports,N
10731,8.4,Manage fixed asset project accounting,Y
10751,8.4.1,Perform capital planning and project approval,Y
10844,8.4.1.1,Develop capital investment policies and procedures,N
10845,8.4.1.2,Develop and approve capital expenditure plans and budgets,N
10846,8.4.1.3,Review and approve capital projects and fixed asset acquisitions,N
10847,8.4.1.4,Conduct financial justification for project approval,N
10752,8.4.2,Perform capital project accounting,Y
10848,8.4.2.1,Create project account codes,N
10849,8.4.2.2,Record project-related transactions,N
10850,8.4.2.3,Monitor and track capital projects and budget spending,N
10851,8.4.2.4,Close/Capitalize projects,N
10852,8.4.2.5,Measure financial returns on completed capital projects,N
13653,8.4.3,Dispose asset,N
13654,8.4.4,Setup new asset details on asset register,N
13655,8.4.5,Maintain fixed assets register,N
13656,8.4.6,Purchase assets,N
13657,8.4.7,Manage asset transfer,N
13658,8.4.8,Manage asset under construction,N
13659,8.4.9,Depreciate asset,N
13660,8.4.10,Manage fixed asset reporting,N
13661,8.4.11,Manage asset scrapping,N
10732,8.5,Process payroll,Y
10753,8.5.1,Report time,Y
10853,8.5.1.1,Establish policies and procedures,N
10854,8.5.1.2,Collect and record employee time worked,N
10855,8.5.1.3,Analyze and report paid and unpaid leave,N
10856,8.5.1.4,"Monitor regular, overtime, and other hours",N
10857,8.5.1.5,Analyze and report employee utilization,N
10754,8.5.2,Manage pay,Y
10858,8.5.2.1,Enter employee time worked into payroll system,N
10859,8.5.2.2,Maintain and administer employee earnings information,N
10860,8.5.2.3,Maintain and administer applicable deductions,N
10861,8.5.2.4,Monitor changes in tax status of employees,N
10862,8.5.2.5,Process and distribute payments,N
10863,8.5.2.6,Process and distribute manual checks,N
10864,8.5.2.7,Process period end adjustments,N
10865,8.5.2.8,Respond to employee payroll inquiries,N
10755,8.5.3,Process payroll taxes,Y
10866,8.5.3.1,Calculate and pay applicable payroll taxes,N
10867,8.5.3.2,Produce and distribute employee annual tax statements,N
10868,8.5.3.3,File regulatory payroll tax forms,N
10733,8.6,Process accounts payable and expense reimbursements,Y
10756,8.6.1,Process accounts payable (AP),Y
10869,8.6.1.1,Verify AP pay file with PO vendor master file,Y
10870,8.6.1.2,Maintain/Manage electronic commerce,Y
10871,8.6.1.3,Audit invoices and key data in AP system,Y
10872,8.6.1.4,Approve payments,Y
10873,8.6.1.5,Process financial accruals and reversals,Y
10874,8.6.1.6,Process taxes,Y
10875,8.6.1.7,Research/Resolve exceptions,Y
10876,8.6.1.8,Process payments,Y
10877,8.6.1.9,Respond to AP inquiries,Y
10878,8.6.1.10,Retain records,Y
10879,8.6.1.11,Adjust accounting records,Y
10757,8.6.2,Process expense reimbursements,Y
10880,8.6.2.1,Establish and communicate expense reimbursement policies and approval limits,Y
10881,8.6.2.2,Capture and report relevant tax data,Y
10882,8.6.2.3,Approve reimbursements and advances,Y
10883,8.6.2.4,Process reimbursements and advances,Y
10884,8.6.2.5,Manage personal accounts,Y
10734,8.7,Manage treasury operations,Y
10758,8.7.1,Manage treasury policies and procedures,N
10885,8.7.1.1,Establish scope and governance of treasury operations,N
10886,8.7.1.2,Establish and publish treasury policies,N
10887,8.7.1.3,Develop treasury procedures,N
10888,8.7.1.4,Monitor treasury procedures,N
10889,8.7.1.5,Audit treasury procedures,N
10890,8.7.1.6,Revise treasury procedures,N
10891,8.7.1.7,Develop and confirm internal controls for treasury,N
10892,8.7.1.8,Define system security requirements,N
10759,8.7.2,Manage cash,Y
10893,8.7.2.1,Manage and reconcile cash positions,N
10894,8.7.2.2,Manage cash equivalents,N
10895,8.7.2.3,Process and oversee electronic fund transfers (EFTs),N
10896,8.7.2.4,Develop cash flow forecasts,N
10897,8.7.2.5,Manage cash flows,N
10898,8.7.2.6,Produce cash management accounting transactions and reports,N
10899,8.7.2.7,Manage and oversee banking relationships,N
10900,8.7.2.8,"Analyze, negotiate, resolve, and confirm bank fees",N
10760,8.7.3,Manage in-house bank accounts,N
10901,8.7.3.1,Manage in-house bank accounts for subsidiaries,N
10902,8.7.3.2,Manage and facilitate inter-company borrowing transactions,N
10903,8.7.3.3,Manage centralized outgoing payments on behalf of subsidiaries,N
10904,8.7.3.4,Manage central incoming payments on behalf of subsidiaries,N
10905,8.7.3.5,Manage internal payments and netting transactions,N
10906,8.7.3.6,Calculate interest and fees for in-house bank accounts,N
10907,8.7.3.7,Provide account statements for in-house bank accounts,N
10761,8.7.4,Manage debt and investment,N
10908,8.7.4.1,Manage financial intermediary relationships,N
10909,8.7.4.2,Manage liquidity,N
10910,8.7.4.3,Manage issuer exposure,N
10911,8.7.4.4,Process and oversee debt and investment transactions,N
10912,8.7.4.5,Process and oversee foreign currency transactions,N
10913,8.7.4.6,Produce debt and investment accounting transaction reports,N
11208,8.7.5,Manage financial risks,Y
11209,8.7.5.1,Manage interest rate risk,N
11210,8.7.5.2,Manage foreign exchange risk,N
11211,8.7.5.3,Manage exposure risk,N
11212,8.7.5.4,Develop and execute hedging transactions,N
11213,8.7.5.5,Evaluate and refine hedging positions,N
11214,8.7.5.6,Produce hedge accounting transactions and reports,N
11215,8.7.5.7,Monitor credit,N
10735,8.8,Manage internal controls,Y
10762,8.8.1,"Establish internal controls, policies and procedures",Y
10914,8.8.1.1,Establish board of directors and audit committee,N
10915,8.8.1.2,Define and communicate code of ethics,N
10916,8.8.1.3,Assign roles and responsibility for internal controls,N
11250,8.8.1.4,Define business process objectives and risks,N
11251,8.8.1.5,Define entity/unit risk tolerances,N
10763,8.8.2,Operate controls and monitor compliance with internal controls policies and procedures,Y
10917,8.8.2.1,Design and implement control activities,N
10918,8.8.2.2,Monitor control effectiveness,N
10919,8.8.2.3,Remediate control deficiencies,N
10920,8.8.2.4,Create compliance function,N
10921,8.8.2.5,Operate compliance function,N
10922,8.8.2.6,Implement and maintain controls-related enabling technologies and tools,N
10764,8.8.3,Report on internal controls compliance,Y
10923,8.8.3.1,Report to external auditors,N
10924,8.8.3.2,"Report to regulators, share/debt-holders, securities exchanges, etc.",N
10925,8.8.3.3,"Report to third parties (e.g., business partners)",N
10926,8.8.3.4,Report to internal management,N
10736,8.9,Manage taxes,Y
10765,8.9.1,Develop tax strategy and plan,N
10927,8.9.1.1,"Develop foreign, national, state and local tax strategy",N
10928,8.9.1.2,Consolidate and optimize total tax plan,N
10929,8.9.1.3,Maintain tax master data,N
10766,8.9.2,Process taxes,Y
10930,8.9.2.1,Perform tax planning/strategy,N
10931,8.9.2.2,Prepare returns,N
10932,8.9.2.3,Prepare foreign taxes,N
10933,8.9.2.4,Calculate deferred taxes,N
13662,8.9.2.5,Manage deferred taxes,N
10934,8.9.2.6,Account for taxes,N
10935,8.9.2.7,Monitor tax compliance,N
10936,8.9.2.8,Address tax inquiries,N
13663,8.9.2.9,Manage withholding tax,N
13664,8.9.2.10,Manage value added tax (VAT),N
13665,8.9.2.11,Manage service tax,N
10737,8.9.3,Manage international funds/consolidation,N
10767,8.9.3.1,Monitor international rates,N
10768,8.9.3.2,Manage transactions,N
10769,8.9.3.3,Monitor currency exposure/hedge currency,N
10770,8.9.3.4,Report results,N
13666,8.10,Perform financial management,N
13669,8.10.1,Perform account operations,N
13676,8.10.1.1,Define enterprise generally accepted principle policies,N
13677,8.10.1.2,Manage foreign currency exchange,N
13678,8.10.1.3,Manage general ledger,N
13679,8.10.1.4,Manage accounts receivable,N
13680,8.10.1.5,Manage accounts payable,N
13681,8.10.1.6,Manage cash liquidity management,N
13670,8.10.2,Audit,N
13671,8.10.3,Manage payroll,N
13682,8.10.3.1,Manage employee payroll details,N
13683,8.10.3.2,Manage employee compensation and reward profiles,N
13684,8.10.3.3,Manage payroll administration and processing,N
13685,8.10.3.4,Manage expense administration and processing,N
13686,8.10.3.5,Manage HR development contributions and rebates,N
13672,8.10.4,Manage treasury operations,N
13687,8.10.4.1,Manage bank reconciliation,N
13688,8.10.4.2,Manage treasury instruments,N
13689,8.10.4.3,Manage treasury business partners,N
13690,8.10.4.4,Manage treasury instrument/agreement,N
13691,8.10.4.5,Manage treasury instrument confirmation,N
13692,8.10.4.6,Manage treasury instrument settlement,N
13693,8.10.4.7,Monitor investments,N
13673,8.10.5,Manage management accounting,N
13694,8.10.5.1,Manage profit centre accounting,N
13695,8.10.5.2,Manage cost center and internal order accounting,N
13696,8.10.5.3,Manage project accounting,N
13697,8.10.5.4,Manage product cost accounting,N
13698,8.10.5.5,Manage profitability accounting,N
13674,8.10.6,Manage carrier accounting,N
13699,8.10.6.1,Manage carrier settlements,N
13700,8.10.6.2,Process carrier adjustments,N
13701,8.10.6.3,Manage carrier payments,N
13702,8.10.6.4,Manage carrier credits,N
13703,8.10.6.5,Manage carrier accounts receivable reconciliation,N
13704,8.10.6.6,Manage carrier related customer bill enquiries,N
13705,8.10.6.7,Manage carrier revenue accruals,N
13675,8.10.7,Manage financial planning,N
13706,8.10.7.1,Manage budgeting and forecasting,N
13707,8.10.7.2,Manage financial reporting,N
13708,8.10.7.3,Manage financial performance,N
13709,8.10.7.4,Manage budget checking,N
13667,8.11,Manage assets,N
13710,8.11.1,Manage real estate,N
13711,8.11.2,Manage asset management operations,N
13712,8.11.2.1,Define asset and asset maintenance plan,N
13713,8.11.2.2,Establish asset strategy and policy,N
13714,8.11.2.3,Manage asset maintenance,N
13715,8.11.2.4,Track asset maintenance,N
13716,8.11.2.5,Manage asset maintenance reporting,N
13717,8.11.2.6,Manage asset maintenance performance and reporting,N
13668,8.12,Manage procurement,N
13718,8.12.1,Manage supplier/ purchase negotiation,N
13723,8.12.1.1,Manage quotation,N
13719,8.12.2,Identify demand requirements,N
13724,8.12.2.1,Manage purchase requisition,N
13725,8.12.2.2,Manage stock replenishments,N
13720,8.12.3,Manage procurement strategy and policy,N
13721,8.12.4,Manage purchase,N
13726,8.12.4.1,Create purchase order,N
13727,8.12.4.2,Track purchase order delivery,N
13728,8.12.4.3,Authorize purchase order,N
13729,8.12.4.4,Manage invoicing,N
13730,8.12.4.5,Manage delivery,N
13722,8.12.5,Determine source supplier/partner,N
