PCF ID,Hierarchy ID,Name,Metrics available?
13813,4.4.7.4,Receive additional resource capability request,N
13814,4.4.7.5,Resource request from Supplier/partner,N
13815,4.4.7.6,Configure resource for service instance,N
13816,4.4.7.7,Interact with resource inventory,N
13817,4.4.7.8,Activate network elements,N
13818,4.4.7.9,Test resource provisioning,N
10323,4.4.8,Ensure quality of service,N
10334,4.4.8.1,Identify completed orders for feedback,N
10335,4.4.8.2,Identify incomplete orders and service failures,Y
10336,4.4.8.3,Solicit customer feedback on services delivered,N
10337,4.4.8.4,Process customer feedback on services delivered,N
13783,4.4.9,Manage service quality,N
13819,4.4.9.1,Monitor service quality,N
13820,4.4.9.2,Analyze service quality,N
13821,4.4.9.3,Improve service quality,N
13822,4.4.9.4,Report service quality performance,N
13823,4.4.9.5,Create service performance degradation report,N
13824,4.4.9.6,Track and manage service quality performance resolution,N
13825,4.4.9.7,Close service performance degradation report,N
13784,4.4.10,Manage service problem,N
13826,4.4.10.1,Create service trouble report,N
13827,4.4.10.2,Diagnose service problem,N
13828,4.4.10.3,Correct and resolve service problem,N
13829,4.4.10.4,Track and manage service problem,N
13830,4.4.10.5,Report service problem,N
13831,4.4.10.6,Close service trouble report,N
13832,4.4.10.7,Survey and analyze service problem,N
13785,4.4.11,Manage resource trouble,N
13833,4.4.11.1,Survey and analyze resource trouble,N
13834,4.4.11.2,Localize resource trouble,N
13835,4.4.11.3,Correct and recover resource trouble,N
13836,4.4.11.4,Track and manage resource trouble,N
13837,4.4.11.5,Close resource trouble,N
13838,4.4.11.6,Report resource trouble,N
13839,4.4.11.7,Create resource trouble report,N
13786,4.4.12,Manage resource performance,N
13840,4.4.12.1,Control resource performance,N
13841,4.4.12.2,Analyze resource performance,N
13842,4.4.12.3,Report resource performance,N
13843,4.4.12.4,Monitor resource performance,N
13844,4.4.12.5,Create resource performance degradation report,N
13845,4.4.12.6,Track and manage resource performance degradation resolution,N
13846,4.4.12.7,Close resource performance degradation report,N
10219,4.5,Manage logistics and warehousing,Y
10338,4.5.1,Define logistics strategy,Y
10343,4.5.1.1,Translate customer service requirements into logistics requirements,N
10344,4.5.1.2,Design logistics network,N
10345,4.5.1.3,Communicate outsourcing needs,N
10346,4.5.1.4,Develop and maintain delivery service policy,N
10347,4.5.1.5,Optimize transportation schedules and costs,N
10348,4.5.1.6,Define key performance measures,N
10339,4.5.2,Plan inbound material flow,Y
10349,4.5.2.1,Plan inbound material receipts,N
10350,4.5.2.2,Manage inbound material flow,N
10351,4.5.2.3,Monitor inbound delivery performance,N
10352,4.5.2.4,Manage flow of returned products,N
10340,4.5.3,Operate warehousing,Y
10353,4.5.3.1,Track inventory deployment,N
10354,4.5.3.2,"Receive, inspect, and store inbound deliveries",N
10355,4.5.3.3,Track product availability,N
10356,4.5.3.4,"Pick, pack, and ship product for delivery",N
10358,4.5.3.5,Track third-party logistics storage and shipping performance,N
10359,4.5.3.6,Manage physical finished goods inventory,N
10341,4.5.4,Operate outbound transportation,Y
10360,4.5.4.1,"Plan, transport, and deliver outbound product",N
10361,4.5.4.2,Track carrier delivery performance,N
10362,4.5.4.3,Manage transportation fleet,N
10363,4.5.4.4,Process and audit carrier invoices and documents,N
10342,4.5.5,Manage returns; manage reverse logistics,Y
10364,4.5.5.1,Authorize and process returns,N
10365,4.5.5.2,Perform reverse logistics,N
10366,4.5.5.3,Perform salvage activities,N
10367,4.5.5.4,Manage and process warranty claims,N
13787,4.5.6,Manage warehouse,N
13847,4.5.6.1,Manage warehouse strategy and policy,N
13848,4.5.6.2,Define and manage warehouse storage location layout,N
13849,4.5.6.3,Manage warehouse inventory,N
13850,4.5.6.4,Track and manage physical warehouse inventory,N
13788,4.5.7,Manage physical resource inventory,N
13851,4.5.7.1,Manage physical inventory,N
13852,4.5.7.2,Manage stock transfer,N
13853,4.5.7.3,Manage receipt of goods and services,N
13854,4.5.7.4,Manage goods issue,N
13855,4.5.7.5,Manage inventory strategy and policy,N
13856,4.6,"Manage service, support operation and readiness",N
13860,4.6.1,Manage service inventory,N
13861,4.6.2,Enable service configuration and activation,N
13862,4.6.3,Support service problem management,N
13863,4.6.4,Enable service quality management,N
13876,4.6.4.1,Administer receipt of service content,N
13877,4.6.4.2,Administer service content aggregation,N
13878,4.6.4.3,Administer service content delivery,N
13864,4.6.5,Support service and specific instance rating,N
13857,4.7,"Manage resource, support operation and readiness",N
13865,4.7.1,Support resource trouble management,N
13866,4.7.2,Manage resource inventory,N
13879,4.7.2.1,Monitor and manage resource inventory,N
13880,4.7.2.2,Manage resource inventory count and audits,N
13881,4.7.2.3,Record resource inventory,N
13882,4.7.2.4,Define resource inventory threshold values,N
13883,4.7.2.5,Manage Resource inventory supply and demand variability,N
13858,4.8,Develop and manage supply chain,N
13867,4.8.1,Strategize and plan supply chain,N
13884,4.8.1.1,Gather and analyze supply chain information,N
13885,4.8.1.2,Establish supply chain strategy and goals,N
13886,4.8.1.3,Define supply chain support strategies,N
13887,4.8.1.4,Produce supply chain business plans,N
13888,4.8.1.5,Gain enterprise commitment to supply chain plans,N
13868,4.8.2,Deliver supply chain capability,N
13889,4.8.2.1,Determine sourcing requirements,N
13890,4.8.2.2,Manage the tender process,N
13891,4.8.2.3,Gain tender decision approval,N
13892,4.8.2.4,Gain approval for commercial arrangements,N
13893,4.8.2.5,Determine potential supplier/partners,N
13894,4.8.2.6,Negotiate commercial arrangements,N
13869,4.8.3,Develop supply chain and manage change,N
13895,4.8.3.1,Manage supplier/partner engagement,N
13896,4.8.3.2,Manage supply chain contract variation,N
13897,4.8.3.3,Manage supplier partner termination,N
13898,4.8.3.4,Manage supply chain supplier/partner termination,N
13859,4.9,Manage supplier/partner relationship,N
13870,4.9.1,Perform supplier/partner relationship management support and readiness,N
13899,4.9.1.1,Support supplier/partner requisition management,N
13900,4.9.1.2,Support supplier/partner reporting and management,N
13901,4.9.1.3,Support supplier/partner performance management,N
13902,4.9.1.4,Support supplier/partner settlement and payment management,N
13903,4.9.1.5,Manage support supplier/partner interface,N
13904,4.9.1.6,Manage supplier/partner inventory,N
13871,4.9.2,Manage supplier/partner requisition,N
13905,4.9.2.1,Select supplier/partner,N
13906,4.9.2.2,Determine supplier/partner pre-requisition feasibility,N
13907,4.9.2.3,Track and manage supplier/partner requisition,N
13908,4.9.2.4,Receive and accept supplier/partner requisition,N
13909,4.9.2.5,Initiate supplier /partner requisition order,N
13910,4.9.2.6,Report supplier/partner requisition,N
13911,4.9.2.7,Close supplier/partner requisition order,N
13872,4.9.3,Report and manage supplier/partner problem,N
13912,4.9.3.1,Initiate supplier/partner problem report,N
13913,4.9.3.2,Receive supplier/partner problem report,N
13914,4.9.3.3,Track and manage supplier/partner problem resolution,N
13915,4.9.3.4,Report supplier/partner problem resolution,N
13916,4.9.3.5,Close supplier/partner problem report,N
13873,4.9.4,Manage supplier/partner performance,N
13917,4.9.4.1,Monitor and control supplier/partner service performance,N
13918,4.9.4.2,Track and manage supplier/partner performance resolution,N
13919,4.9.4.3,Report supplier/partner performance,N
13920,4.9.4.4,Close supplier/partner performance degradation report,N
13874,4.9.5,Manage supplier/partner settlement and payment,N
13921,4.9.5.1,Manage account,N
13922,4.9.5.2,Receive and assess invoice,N
13923,4.9.5.3,Negotiate and approve invoice,N
13924,4.9.5.4,Issue settlement notice and payment,N
13875,4.9.6,Manage supplier/partner invoice,N
13925,4.9.6.1,Manage supplier/partner requests,N
13926,4.9.6.2,Analyze and report supplier/partner interactions,N
13927,4.9.6.3,Mediate and orchestrate supplier/partner interactions,N
10006,5,Manage Customer Service,Y
10378,5.1,Develop customer care/customer service strategy,Y
10381,5.1.1,"Develop customer service segmentation/prioritization (e.g., tiers)",N
10384,5.1.1.1,Analyze existing customers,N
10385,5.1.1.2,Analyze feedback of customer's needs,N
10382,5.1.2,Define customer service policies and procedures,N
10383,5.1.3,Establish service levels for customers,Y
10379,5.2,Plan and manage customer service operations,Y
10387,5.2.1,Plan and manage customer service work force,Y
10390,5.2.1.1,Forecast volume of customer service contacts,N
10393,5.2.1.2,Monitor and evaluate quality of customer interactions with customer service representatives,N
10388,5.2.2,Manage customer service requests/inquiries,Y
10394,5.2.2.1,Receive customer requests/inquiries,N
13482,5.2.2.2,Analyze problem/request,N
13483,5.2.2.3,Resolve problem/request or hand over to responsible areas,N
13484,5.2.2.4,Receive solution,N
10395,5.2.2.5,Route customer requests/inquiries,N
10396,5.2.2.6,Respond to customer requests/inquiries,N
10389,5.2.3,Manage customer complaints,N
10397,5.2.3.1,Receive customer complaints,N
10398,5.2.3.2,Route customer complaints,N
10399,5.2.3.3,Resolve customer complaints,N
10400,5.2.3.4,Respond to customer complaints,N
13485,5.2.4,Perform customer relationship management (CRM) support and readiness,N
13487,5.2.4.1,Support customer interface management,N
13488,5.2.4.2,Support order handling,N
13489,5.2.4.3,Support problem handling,N
13490,5.2.4.4,Support billing and collections,N
13491,5.2.4.5,Support retention and loyalty,N
13492,5.2.4.6,Support marketing fulfillment,N
13493,5.2.4.7,Support selling,N
13494,5.2.4.8,Manage campaigns,N
13495,5.2.4.9,Manage customer inventory,N
13496,5.2.4.10,Manage product offering inventory,N
13497,5.2.4.11,Manage sales inventory,N
13486,5.2.5,Manage customer interface,N
13498,5.2.5.1,Manage request,N
13499,5.2.5.2,Manage contact,N
13500,5.2.5.3,Analyze and report on customer,N
13501,5.2.5.4,Mediate and orchestrate customer interactions,N
13502,5.2.6,Obtain marketing fulfillment response,N
13508,5.2.6.1,Issue and distribute marketing collateral,N
13509,5.2.6.2,Track marketing leads,N
13503,5.2.7,Segment customers,N
13510,5.2.7.1,Identify customer groups,N
13511,5.2.7.2,Determine content requirements based on individual customer groups,N
13512,5.2.7.3,Analyze device capabilities of individual customer groups,N
13513,5.2.7.4,Map device against target segments,N
13504,5.2.8,Handle orders,N
13514,5.2.8.1,Establish order,N
13518,5.2.8.1.1,Add directory,N
13519,5.2.8.1.2,Assign telephone number (TN) pre-order,N
13520,5.2.8.1.3,Add service features,N
13521,5.2.8.1.4,Resume service,N
13522,5.2.8.1.5,Resume service address,N
13523,5.2.8.1.6,Remove service,N
13524,5.2.8.1.7,Change directory listing,N
13525,5.2.8.1.8,Move telephone numbers,N
13526,5.2.8.1.9,Upgrade service,N
13527,5.2.8.1.10,Add service line item,N
13528,5.2.8.1.11,Add products,N
13529,5.2.8.1.12,Deactivate service,N
13530,5.2.8.1.13,Suspend customer,N
13531,5.2.8.1.14,Suspend service address,N
13532,5.2.8.1.15,Create commitment schedule for installation,N
13533,5.2.8.1.16,Create commitment schedule for problem resolution,N
13534,5.2.8.1.17,Check progress of order tasks,N
13535,5.2.8.1.18,Perform audit reporting,N
13515,5.2.8.2,Close customer order,N
13516,5.2.8.3,Complete order,N
13517,5.2.8.4,Report customer order handling,N
13505,5.2.9,Manage customer quality of service (QoS)/ service level agreement (SLA),N
13536,5.2.9.1,Access customer QoS/SLA management,N
13537,5.2.9.2,Manage QoS violation,N
13538,5.2.9.3,Report customer quality of service (QoS) performance,N
13539,5.2.9.4,Create customer QoS performance degradation report,N
13540,5.2.9.5,Track and manage customer QoS performance resolution,N
13541,5.2.9.6,Close customer QoS performance degradation report,N
13506,5.2.10,Handle problems,N
13542,5.2.10.1,Create customer problem report,N
13543,5.2.10.2,Isolate customer problem,N
13544,5.2.10.3,Report customer problem,N
13545,5.2.10.4,Track and manage customer problem,N
13546,5.2.10.5,Close customer problem report,N
13547,5.2.10.6,Correct and recover customer problem,N
13507,5.2.11,Retain customers and promote loyalty,N
13548,5.2.11.1,Establish and terminate customer relationship,N
13549,5.2.11.2,Build customer insight,N
13550,5.2.11.3,Personalize customer profile for retention and loyalty,N
13551,5.2.11.4,Analyze and manage customer risk,N
13552,5.2.11.5,Validate customer satisfaction,N
13553,5.3,Assure service,N
13554,5.3.1,Detect problem,N
13560,5.3.1.1,Monitor continuously/analyze service,N
13561,5.3.1.2,Perform regular/preventative maintenance cycles,N
13562,5.3.1.3,Take proactive control,N
13563,5.3.1.4,"Receive customer complaints on service assurance related problems (e.g. service outage, QoS Problems)",N
13555,5.3.2,Correlate problems,N
13564,5.3.2.1,Collect problems,N
13565,5.3.2.2,Conduct fault analysis/diagnostic,N
13566,5.3.2.3,Correlate problems to find problem hot spots (performance and fault data correlation),N
13556,5.3.3,Analyze impact,N
13567,5.3.3.1,"Analyze impact of service problems (violation of SLAs, network outage, etc)",N
13568,5.3.3.2,Define severity status of problems,N
13569,5.3.3.3,Notify customer (service) on impact of problems and expected resolution times respectively out-of-service times,N
13557,5.3.4,Prioritize problems,N
13570,5.3.4.1,Examine quality of service (QoS),N
13571,5.3.4.2,Determine number of customers affected by problem,N
13572,5.3.4.3,Determine type of customer affected by problem,N
13573,5.3.4.4,Identify severity status,N
13574,5.3.4.5,Prioritize problem,N
13575,5.3.4.6,Schedule repair/restoration technicians to do work,N
13558,5.3.5,Resolve problems/ restore service,N
13576,5.3.5.1,Resolve problems/ restore service,N
13577,5.3.5.2,Document cause of problem and problem resolution,N
13578,5.3.5.3,"Update knowledge database, if available",N
13559,5.3.6,Maintain customer service information,N
13579,5.3.6.1,"Inform the customer/customer service on ""service restored"" status",N
13480,5.3.6.2,Renegotiate/Optimize existing contracts based on supplier performance,N
13581,5.3.6.3,Close trouble ticket,N
10380,5.4,Measure and evaluate customer service operations,Y
10401,5.4.1,Measure customer satisfaction with customer requests/inquiries handling,N
10404,5.4.1.1,Gather and solicit post-sale customer feedback on products and services,N
10405,5.4.1.2,Solicit post-sale customer feedback on ad effectiveness,N
10406,5.4.1.3,Analyze product and service satisfaction data and identify improvement opportunities,N
10407,5.4.1.4,Provide customer feedback to product management on products and services,N
10402,5.4.2,Measure customer satisfaction with customer-complaint handling and resolution,Y
11236,5.4.2.1,Solicit customer feedback on complaint handling and resolution,N
11237,5.4.2.2,Analyze customer complaint data and identify improvement opportunities,N
10403,5.4.3,Measure customer satisfaction with products and services,Y
11238,5.4.3.1,Gather and solicit post-sale customer feedback on products and services,N
11239,5.4.3.2,Solicit post-sale customer feedback on ad effectiveness,N
11240,5.4.3.3,Analyze product and service satisfaction data and identify improvement opportunities,N
11241,5.4.3.4,Provide customer feedback to product management on products and services,N
10007,6,Develop and Manage Human Capital,Y
10409,6.1,"Develop and manage human resources (HR) planning, policies, and strategies",Y
10415,6.1.1,Develop human resources strategy,Y
13582,6.1.1.1,Manage organization structure,N
13583,6.1.1.2,Manage and co-ordinate organizational change,N
10418,6.1.1.3,Identify strategic HR needs,N
10419,6.1.1.4,Define HR and business function roles and accountability,N
10420,6.1.1.5,Determine HR costs,N
13584,6.1.1.6,Manage headcount planning,N
13585,6.1.1.7,Map cost structure to organizational unit,N
13586,6.1.1.8,Define employee development guidelines,N
10421,6.1.1.9,Establish HR measures,N
10422,6.1.1.10,Communicate HR strategies,N
10416,6.1.2,Develop and implement human resources plans,Y
13587,6.1.2.1,Gather skill requirements according to corporate strategy and market environment,N
13588,6.1.2.2,Plan employee requirements per unit/organization,N
10423,6.1.2.3,Gather skill requirements according to corporate strategy and market environment,N
10424,6.1.2.4,Plan employee resourcing requirements per unit/organization,N
10425,6.1.2.5,Develop compensation plan,N
10426,6.1.2.6,Develop succession plan,Y
10427,6.1.2.7,Develop employee diversity plan,N
10428,6.1.2.8,Develop other HR programs,N
10429,6.1.2.9,Develop HR policies,N
10430,6.1.2.10,Administer HR policies,N
10431,6.1.2.11,Plan employee benefits,N
13589,6.1.2.12,Plan training and development programs,N
13590,6.1.2.13,Create and maintain position and job,N
13591,6.1.2.14,Identify workforce competency and skills,N
13592,6.1.2.15,Define workforce competency and skill needs,N
10432,6.1.2.16,Develop strategy for HR systems/technologies/tools,N
10433,6.1.2.17,Develop workforce strategy models,N
13593,6.1.2.18,Define costs of workforce strategy models,N
10417,6.1.3,Monitor and update plans,Y
13594,6.1.3.1,Monitor existing skill profiles of employees,N
10434,6.1.3.2,Measure realization of objectives,N
10435,6.1.3.3,Measure contribution to business strategy,N
10436,6.1.3.4,Communicate plans and provide updates to stakeholders,N
10437,6.1.3.5,Determine value added from HR function,N
10438,6.1.3.6,Review and revise HR plans,N
10410,6.2,"Recruit, source, and select employees",Y
10439,6.2.1,Create and develop employee requisitions,N
13595,6.2.1.1,Analyze corporate job,N
13596,6.2.1.2,Define job/skill profiles,N
10445,6.2.1.3,Align staffing plan to workforce plan and business unit strategies/resource needs,N
10446,6.2.1.4,Develop and open job requisition,N
10447,6.2.1.5,Develop a job description,N
10448,6.2.1.6,Post requisition,N
10449,6.2.1.7,Manage internal/external job posting web sites,N
10450,6.2.1.8,Change/Update requisition,N
10451,6.2.1.9,Notify hiring manager,N
10452,6.2.1.10,Manage requisition date,N
10440,6.2.2,Recruit/Source candidates,N
10453,6.2.2.1,Determine recruitment methods,N
10454,6.2.2.2,Perform recruiting activities/events,N
10455,6.2.2.3,Manage recruitment vendors,N
10441,6.2.3,Screen and select candidates,N
10456,6.2.3.1,Identify and deploy candidate selection tools,N
10457,6.2.3.2,Interview candidates,N
10458,6.2.3.3,Test candidates,N
10459,6.2.3.4,Select and reject candidates,N
10442,6.2.4,Manage pre-placement verification,N
10460,6.2.4.1,Complete candidate background information,N
10461,6.2.4.2,Conduct pre-employment screening,N
10462,6.2.4.3,Recommend/Not recommend candidate,N
10443,6.2.5,Manage new hire/re-hire,Y
10463,6.2.5.1,Draw up and make offer,N
10464,6.2.5.2,Negotiate offer,N
10465,6.2.5.3,Hire candidate,N
10444,6.2.6,Track candidates,N
10466,6.2.6.1,Create applicant record,N
10467,6.2.6.2,Manage/Track applicant data,N
10468,6.2.6.3,Archive and retain records of non-hires,N
10411,6.3,Develop and counsel employees,Y
10469,6.3.1,Manage employee orientation and deployment,Y
10474,6.3.1.1,Create/Maintain employee on-boarding program,N
10477,6.3.1.1.1,Develop employee induction program,N
10478,6.3.1.1.2,Maintain/Update employee induction program,N
10475,6.3.1.2,Introduce new employees to managers,N
10476,6.3.1.3,Introduce workplace,N
11243,6.3.1.4,Evaluate the effectiveness of the employee on-boarding program,N
10470,6.3.2,Manage employee performance,Y
10479,6.3.2.1,Define performance objectives,N
10480,6.3.2.2,"Review, appraise, and manage employee performance",N
10481,6.3.2.3,Evaluate and review performance program,N
10471,6.3.3,Manage employee relations,Y
10482,6.3.3.1,Manage health and safety,Y
10483,6.3.3.2,Manage labor relations,Y
10484,6.3.3.3,Manage collective bargaining process,N
10485,6.3.3.4,Manage labor management partnerships,N
10472,6.3.4,Manage employee development,Y
10486,6.3.4.1,Develop competency management plans,N
10487,6.3.4.2,Define employee development guidelines,N
10488,6.3.4.3,Develop employee career plans,N
10489,6.3.4.4,Manage employee skills development,N
13597,6.3.4.5,Administer training and events,N
10473,6.3.5,Develop and train employees,Y
10490,6.3.5.1,Align employee and organization development needs,N
10491,6.3.5.2,Develop competencies,N
10492,6.3.5.3,Establish training needs by analysis of required and available skills,N
10493,6.3.5.4,"Develop, conduct, and manage employee and/or management training programs",Y
13598,6.3.5.5,Manage personnel development,N
13599,6.3.6,Establish employee communities,N
10412,6.4,Reward and retain employees,Y
10494,6.4.1,"Develop and manage reward, recognition, and motivation programs",Y
10498,6.4.1.1,Develop salary/compensation structure and plan,N
10499,6.4.1.2,Develop benefits and reward plan,N
10500,6.4.1.3,Perform competitive analysis of benefit and rewards,N
10501,6.4.1.4,"Identify compensation requirements based on financial, benefits, and HR policies",N
10502,6.4.1.5,Administer compensation and rewards to employees,N
10503,6.4.1.6,Reward and motivate employees,N
10495,6.4.2,Manage and administer benefits,N
10504,6.4.2.1,Deliver employee benefits program,N
10505,6.4.2.2,Administer benefit enrollment,N
10506,6.4.2.3,Process claims,N
10507,6.4.2.4,Perform benefit reconciliation,N
10496,6.4.3,Manage employee assistance and retention,N
10508,6.4.3.1,Deliver programs to support work/life balance for employees,N
10509,6.4.3.2,Develop family support systems,N
10510,6.4.3.3,Review retention and motivation indicators,N
10511,6.4.3.4,Review compensation plan,N
10497,6.4.4,Payroll administration,Y
10413,6.5,Re-deploy and retire employees,Y
10512,6.5.1,Manage promotion and demotion process,Y
10513,6.5.2,Manage separation,Y
10514,6.5.3,Manage retirement,N
10515,6.5.4,Manage leave of absence,N
10516,6.5.5,Develop and implement employee outplacement,N
10517,6.5.6,Manage deployment of personnel,N
10518,6.5.7,Relocate employees and manage assignments,Y
10519,6.5.8,Manage employment reduction and retirement,N
10520,6.5.9,Manage expatriates,Y
10521,6.5.10,Manage employee relocation process,N
10414,6.6,Manage employee information,Y
10522,6.6.1,Manage reporting processes,N
10523,6.6.2,Manage employee inquiry process,Y
10524,6.6.3,Manage and maintain employee data,N
10525,6.6.4,Manage human resource information systems (HRIS),N
10526,6.6.5,Develop and manage employee metrics,N
10527,6.6.6,Develop and manage time and attendance,N
10528,6.6.7,Manage employee communication,N
10529,6.6.7.1,Develop employee communication plan,N
10530,6.6.7.2,Manage/Collect employee suggestions and perform employee research,N
10531,6.6.7.3,Manage employee grievances,Y
10532,6.6.7.4,Publish employee communications,N
13600,6.6.8,Manage employee compensation,N
13601,6.6.8.1,Manage personnel cost planning,N
13602,6.7,Manage employee and labor relations,N
13605,6.7.1,Manage employee relations,N
13615,6.7.1.1,Manage terms of employment,N
13616,6.7.1.2,Manage union contact agreements,N
13617,6.7.1.3,Manage employee arbitration,N
13618,6.7.1.4,Manage labor contract development,N
13619,6.7.1.5,Manage employee counseling,N
13603,6.8,Manage occupational health and safety,N
13606,6.8.1,Manage health and safety planning,N
13607,6.8.2,Track and report health and safety incidents,N
13604,6.9,Perform workforce administration,N
13608,6.9.1,Manage personnel profile,N
13609,6.9.2,Manage personnel time management,N
13610,6.9.3,Manage personnel benefit administration,N
13611,6.9.4,Manage organization structure,N
13612,6.9.5,Manage recruitment,N
13613,6.9.6,Manage compensation,N
13614,6.9.7,Manage leave,N
10008,7,Manage Information Technology,Y
10563,7.1,Manage the business of information technology,Y
10570,7.1.1,Develop the enterprise IT strategy,Y
10603,7.1.1.1,Build strategic intelligence,N
10604,7.1.1.2,Identify long-term IT needs of the enterprise in collaboration with stakeholders,N
10605,7.1.1.3,"Define strategic standards, guidelines and principles",N
10606,7.1.1.4,Define and establish IT architecture and development standards,N
10607,7.1.1.5,Define strategic vendors for IT components,N
10608,7.1.1.6,Establish IT governance organization and processes,N
10609,7.1.1.7,Build strategic plan to support business objectives,N
10571,7.1.2,Define the enterprise architecture,N
10611,7.1.2.1,Establish the enterprise architecture definition,N
10612,7.1.2.2,Confirm enterprise architecture maintenance approach,N
10613,7.1.2.3,Maintain the relevance of the enterprise architecture,N
10614,7.1.2.4,Act as clearinghouse for IT research and innovation,N
10615,7.1.2.5,Govern the enterprise architecture,N
13620,7.1.2.6,Gather internal and external requirements,N
13621,7.1.2.7,Define master plan for IT architecture enhancements according to business requirements,N
13622,7.1.2.8,Incorporate technology development,N
10572,7.1.3,Manage the IT portfolio,N
10616,7.1.3.1,Establish the IT portfolio,N
10617,7.1.3.2,Analyze and evaluate the value of the IT portfolio for the enterprise,N
10618,7.1.3.3,Provision resources in accordance with strategic priorities,N
10573,7.1.4,Perform IT research and innovation,N
10620,7.1.4.1,Research technologies to innovate IT services and solutions,N
10621,7.1.4.2,Transition viable technologies for IT services and solutions development,N
10574,7.1.5,Perform IT financial management,N
10622,7.1.5.1,Develop and maintain IT services and solutions cost transparency,N
10623,7.1.5.2,Establish and maintain accounting process,N
10624,7.1.5.3,Tie project funding to business case decision checkpoints,N
10575,7.1.6,Evaluate and communicate IT business value and performance,Y
10625,7.1.6.1,Establish and monitor key performance indicators,N
